{
  "$schema": "https://json-schema.org/draft/2020-12/schema",
  "$id": "https://raw.githubusercontent.com/truefoundry/nat-ips/main/schema/nat-ips.schema.json",
  "title": "TrueFoundry NAT IP source file",
  "description": "Schema for the hand-edited source files under data/. Built artifacts in dist/ use the same entry shape inside a flat envelope.",
  "type": "object",
  "required": ["plane", "control_plane", "entries"],
  "additionalProperties": false,
  "properties": {
    "$schema": {
      "type": "string",
      "description": "Relative path to this schema, so editors give completion and inline validation."
    },
    "plane": {
      "enum": ["control_plane", "gateway"],
      "description": "Which plane this file describes."
    },
    "control_plane": {
      "enum": ["us", "eu"],
      "description": "Which TrueFoundry control plane owns these IPs."
    },
    "host": {
      "type": "string",
      "description": "Exact hostname customers call, e.g. us.truefoundry.cloud"
    },
    "host_pattern": {
      "type": "string",
      "description": "Wildcard hostname pattern, e.g. *.us.truefoundry.cloud"
    },
    "entries": {
      "type": "array",
      "minItems": 1,
      "items": { "$ref": "#/$defs/entry" }
    }
  },
  "$defs": {
    "entry": {
      "type": "object",
      "required": ["type", "cloud", "region", "continent", "nat_ips"],
      "additionalProperties": false,
      "properties": {
        "type": {
          "enum": ["control_plane", "gateway"]
        },
        "cloud": {
          "enum": ["aws", "gcp", "azure"]
        },
        "region": {
          "type": "string",
          "minLength": 1,
          "description": "Cloud provider region id, e.g. us-east-1 or europe-southwest1."
        },
        "continent": {
          "enum": ["na", "sa", "eu", "ap", "me", "af", "oc"]
        },
        "airport_code": {
          "type": "string",
          "pattern": "^[a-z]{3}$",
          "description": "IATA code for the PoP. Required for gateway entries."
        },
        "hostname": {
          "type": "string",
          "format": "hostname",
          "description": "Regional gateway endpoint customers resolve. Required for gateway entries."
        },
        "notes": {
          "type": "string"
        },
        "nat_ips": {
          "type": "array",
          "minItems": 1,
          "uniqueItems": true,
          "items": {
            "type": "string",
            "pattern": "^((25[0-5]|2[0-4][0-9]|1[0-9][0-9]|[1-9]?[0-9])\\.){3}(25[0-5]|2[0-4][0-9]|1[0-9][0-9]|[1-9]?[0-9])/(3[0-2]|[12]?[0-9])$",
            "description": "IPv4 CIDR. Single addresses are written as /32."
          }
        }
      },
      "allOf": [
        {
          "if": {
            "properties": { "type": { "const": "gateway" } },
            "required": ["type"]
          },
          "then": {
            "required": ["airport_code", "hostname"]
          }
        }
      ]
    }
  }
}
