{
  "$schema": "../../schema/nat-ips.schema.json",
  "plane": "control_plane",
  "control_plane": "us",
  "host_pattern": "*.us.truefoundry.cloud",
  "entries": [
    {
      "type": "control_plane",
      "cloud": "aws",
      "region": "us-east-1",
      "continent": "na",
      "nat_ips": [
        "34.175.219.109/32",
        "34.175.44.33/32"
      ],
      "notes": "PLACEHOLDER - not real data, replace before making this repo public"
    }
  ]
}
