{
  "$schema": "../../schema/nat-ips.schema.json",
  "plane": "control_plane",
  "control_plane": "eu",
  "host_pattern": "*.eu.truefoundry.cloud",
  "entries": [
    {
      "type": "control_plane",
      "cloud": "aws",
      "region": "eu-west-1",
      "continent": "eu",
      "nat_ips": [
        "34.175.219.109/32",
        "34.175.44.33/32"
      ],
      "notes": "PLACEHOLDER - not real data, replace before making this repo public"
    }
  ]
}
